{
	"$schema": "https://json-schema.org/draft/2020-12/schema",
	"$id": "https://unpkg.com/readie/schemas/readie.schema.json",
	"title": "Readie Config",
	"description": "Configuration for generating README files with Readie.",
	"type": "object",
	"additionalProperties": false,
	"required": ["title", "description"],
	"properties": {
		"$schema": {
			"type": "string",
			"description": "Optional JSON Schema URL for editor integration."
		},
		"version": {
			"type": "string",
			"description": "Config version. Current value is 1.",
			"default": "1",
			"enum": ["1"]
		},
		"title": {
			"type": "string",
			"minLength": 1
		},
		"description": {
			"type": "string",
			"minLength": 1
		},
		"output": {
			"type": "string",
			"description": "Output README path. Relative paths are resolved from the config file directory."
		},
		"includeTableOfContents": {
			"type": "boolean",
			"default": true
		},
		"features": {
			"type": "array",
			"items": { "type": "string" }
		},
		"prerequisites": {
			"type": "array",
			"items": { "type": "string" }
		},
		"installation": {
			"type": "array",
			"items": { "type": "string" }
		},
		"manualInstallation": {
			"type": "array",
			"items": { "type": "string" }
		},
		"usage": {
			"type": "array",
			"items": { "type": "string" }
		},
		"commands": {
			"type": "array",
			"items": {
				"type": "object",
				"additionalProperties": false,
				"required": ["name", "description"],
				"properties": {
					"name": { "type": "string", "minLength": 1 },
					"description": { "type": "string", "minLength": 1 }
				}
			}
		},
		"globalFlags": {
			"type": "array",
			"items": {
				"type": "object",
				"additionalProperties": false,
				"required": ["flag", "description"],
				"properties": {
					"flag": { "type": "string", "minLength": 1 },
					"description": { "type": "string", "minLength": 1 }
				}
			}
		},
		"badges": {
			"type": "array",
			"items": {
				"type": "object",
				"additionalProperties": false,
				"required": ["label", "image"],
				"properties": {
					"label": { "type": "string", "minLength": 1 },
					"image": { "type": "string", "minLength": 1 },
					"link": { "type": "string", "minLength": 1 }
				}
			}
		},
		"banner": {
			"type": "string",
			"description": "Raw markdown or HTML rendered before the title. In readie.global.json, top-level string values support `{{title}}`, `{{packageName}}`, and `{{packageNameEncoded}}` interpolation."
		},
		"quickStart": {
			"type": "string",
			"description": "Raw markdown rendered in a Quick Start section."
		},
		"support": {
			"type": "array",
			"items": { "type": "string" }
		},
		"contributing": {
			"type": "array",
			"items": { "type": "string" }
		},
		"security": {
			"type": "string"
		},
		"license": {
			"description": "License section content as markdown text or a named URL object.",
			"oneOf": [
				{ "type": "string", "minLength": 1 },
				{
					"type": "object",
					"additionalProperties": false,
					"required": ["name", "url"],
					"properties": {
						"name": { "type": "string", "minLength": 1 },
						"url": { "type": "string", "minLength": 1 }
					}
				}
			]
		},
		"footer": {
			"type": "string",
			"description": "Raw markdown appended to the end of the README."
		},
		"docsLink": {
			"type": "string"
		},
		"quickStartLink": {
			"type": "string"
		},
		"customSections": {
			"type": "object",
			"additionalProperties": { "type": "string" }
		}
	},
	"examples": [
		{
			"$schema": "https://unpkg.com/readie/schemas/readie.schema.json",
			"version": "1",
			"title": "my-library",
			"description": "A concise project description.",
			"includeTableOfContents": true,
			"features": ["Fast", "Typed", "Zero-config"],
			"installation": ["```bash\\nnpm i my-library\\n```"],
			"usage": ["Import and use the library in your project."],
			"commands": [
				{ "name": "my-cli init", "description": "Initialize project files." }
			]
		}
	]
}
